<?xml version="1.0" encoding="utf-8"?>
<pages xmlns="urn:ans:net10:web:map-pages"
	   xmlns:xsi="http://w3.org"
	   xsi:schemaLocation="urn:ans:net10:web:map-pages MapPages.xsd">

	<item target="brand" face="Фирстиль">
		<item target="colors" face="Цвета|Основные {0}" />
		<item target="logo-guap" face="Логотипы ГУАП" />
		<item target="logo-guap-deps" face="Логотипы подразделений ГУАП" />
	</item>

	<item target="helpers" face="Helpers">
		<item target="news" face="News">
			<item target="node" face="Узел (публикации, объявления, мероприятия)" />
		</item>
	</item>

	<item target="libs" face="Libs" start="false">
		<item target="bootstrap-icons_1-11-3" />
		<item target="guap-icons_11" />
	</item>

</pages>
